{
  "$schema": "../../../schemas/lesson.schema.json",
  "schemaVersion": 1,
  "id": "ros2.message.twist-01",
  "title": "构造平面速度消息（C++ 教学模型）",
  "track": "ros2-basics",
  "language": "cpp",
  "questionType": "programming",
  "difficulty": "beginner",
  "summary": "用普通 C++ 结构体理解 Twist 的线速度和角速度字段，不启动真实 ROS 2 节点。",
  "prerequisites": [],
  "knowledge": [
    "Twist",
    "结构体初始化",
    "成员赋值"
  ],
  "target": "native",
  "starter": "starter",
  "statement": "README.md",
  "build": {
    "standard": "c++17",
    "sources": [
      "twist_model.cpp"
    ],
    "tests": [
      "test_twist_model.cpp"
    ],
    "includeDirs": [
      "."
    ],
    "timeoutSeconds": 5
  },
  "hints": [
    "先完整初始化消息，确保未使用分量为零。",
    "本题约定 x 为前进方向、z 为竖直方向。",
    "只需把 forward 写入 linear.x，把 yaw_rate 写入 angular.z；其他分量保持零。"
  ],
  "origin": {
    "type": "self-authored",
    "license": "project-license"
  }
}
