{
  "$schema": "../../../schemas/lesson.schema.json",
  "schemaVersion": 1,
  "id": "cpp.string.count-char-01",
  "title": "统计字符串中的指定字符",
  "track": "cpp-basics",
  "language": "cpp",
  "questionType": "programming",
  "difficulty": "beginner",
  "summary": "练习 std::string、范围 for 和计数。",
  "prerequisites": [],
  "knowledge": ["std::string", "range-for", "counting"],
  "target": "native",
  "starter": "starter",
  "statement": "README.md",
  "build": { "standard": "c++17", "sources": ["count_char.cpp"], "tests": ["test_count_char.cpp"], "includeDirs": ["."], "timeoutSeconds": 5 },
  "hints": ["用范围 for 逐个取得字符串中的 char。", "字符与 target 相等时把计数加一。", "返回类型使用 std::size_t。"],
  "origin": { "type": "self-authored", "license": "project-license" }
}
