{
  "$schema": "../../../schemas/lesson.schema.json",
  "schemaVersion": 1,
  "id": "cpp.syntax.clamp-int-01",
  "title": "限制整数范围",
  "track": "cpp-basics",
  "language": "cpp",
  "questionType": "programming",
  "difficulty": "beginner",
  "summary": "使用条件判断把整数限制在闭区间内。",
  "prerequisites": [],
  "knowledge": ["if", "comparison", "return"],
  "target": "native",
  "starter": "starter",
  "statement": "README.md",
  "build": { "standard": "c++17", "sources": ["clamp_int.cpp"], "tests": ["test_clamp_int.cpp"], "includeDirs": ["."], "timeoutSeconds": 5 },
  "hints": ["先判断 value 是否小于下限。", "再判断 value 是否大于上限。", "位于区间内时原样返回 value。"],
  "origin": { "type": "self-authored", "license": "project-license" }
}
